{
  "run_id": "f47ac10b-58cc-4372-a567-0e02b2c3d479",
  "seq": 0,
  "ts": "2026-06-16T20:00:00Z",
  "type": "tool_call",
  "tenant_id": "11111111-2222-3333-4444-555555555555",
  "session_id": "8b1f0e2a-3c4d-4e5f-9a0b-1c2d3e4f5a6b",
  "origin_session_id": "8b1f0e2a-3c4d-4e5f-9a0b-1c2d3e4f5a6b",
  "span_id": "span-001",
  "parent_span_id": null,
  "actor": { "kind": "agent", "id": "agent_abc123" },
  "data": { "tool": "market.get_ohlcv", "args": { "symbol": "AAPL", "range": "1Y" } }
}
